{
  "$schema": "https://json-schema.org/draft/2020-12/schema",
  "$id": "https://resecta.app/schemas/dl_patterns.schema.json",
  "title": "Per-state driver-license-number pattern gazetteer",
  "description": "Structural patterns (anchored regex + length_range + alphabet + sample + per-row legal posture / attestation) for all 51 jurisdictions (50 states + DC). Promoted from src/resecta_data/gazetteers/dl_patterns/sources/dl_patterns_candidates.json after candidates-file review. License posture is one of state-work / permissive-OSS-MIT / state-statute-anchored / aamva-envelope (no needs-legal-review posture). 11 envelope rows ship the canonical AAMVA M1 envelope `^[A-Z0-9]{8,13}$` with state-format claim retracted (`state_format_claimed: false`); 3 statute-anchored rows (NC, TN, UT) ship tight per-state regex anchored to UVC-template state-statute primary publication at the top attestation rank; remaining 37 rows (11 state-work + 26 permissive-OSS-MIT) ship per-state regex with attestation at the lower ranks. The `_advisory_note` at the file root is a WA specimen-image audit (no separate audit deliverable).",
  "type": "object",
  "additionalProperties": false,
  "required": [
    "version",
    "generated_by",
    "generated_date",
    "seed",
    "source_briefs",
    "rows"
  ],
  "properties": {
    "version": {
      "type": "integer",
      "minimum": 1,
      "description": "Schema version. Bump when the shape changes in a way the Swift decoder must observe."
    },
    "generated_by": {
      "type": "string",
      "minLength": 1
    },
    "generated_date": {
      "type": "string",
      "pattern": "^\\d{4}-\\d{2}-\\d{2}$",
      "description": "Deterministic ISO date lifted verbatim from the candidates JSON. Wall-clock content is banned from payloads."
    },
    "seed": {
      "type": "integer",
      "minimum": 0,
      "description": "PRNG seed recorded for reproducibility. Unused by this builder (deterministic transcription); preserved for uniformity across artifacts."
    },
    "source_briefs": {
      "type": "array",
      "minItems": 1,
      "uniqueItems": true,
      "items": {"type": "string", "minLength": 1}
    },
    "_advisory_note": {
      "type": "string",
      "minLength": 1,
      "description": "Advisory-only WA specimen-image audit + posture-distribution + closed-flag summary. Ships as a JSON-only advisory inside this artifact (no separate audit deliverable). Carried through to the shipping artifact at build time."
    },
    "rows": {
      "type": "array",
      "minItems": 51,
      "maxItems": 51,
      "description": "Per-state pattern rows in ascending state_code order. Fixed at 51 (50 states + DC).",
      "items": {
        "type": "object",
        "additionalProperties": false,
        "required": [
          "state_code",
          "state_name",
          "patterns",
          "length_range",
          "alphabet",
          "sample",
          "source_url",
          "source_verified_date",
          "license_posture",
          "license_notes",
          "attestation",
          "state_format_claimed",
          "confidence",
          "f_flags"
        ],
        "properties": {
          "state_code": {
            "type": "string",
            "enum": [
              "AK", "AL", "AR", "AZ", "CA", "CO", "CT", "DC", "DE", "FL",
              "GA", "HI", "IA", "ID", "IL", "IN", "KS", "KY", "LA", "MA",
              "MD", "ME", "MI", "MN", "MO", "MS", "MT", "NC", "ND", "NE",
              "NH", "NJ", "NM", "NV", "NY", "OH", "OK", "OR", "PA", "RI",
              "SC", "SD", "TN", "TX", "UT", "VA", "VT", "WA", "WI", "WV",
              "WY"
            ],
            "description": "Closed enum: 50 USPS state codes + DC."
          },
          "state_name": {
            "type": "string",
            "minLength": 1
          },
          "patterns": {
            "type": "array",
            "minItems": 1,
            "uniqueItems": true,
            "description": "One or more anchored regex strings describing the DL-number shape. Unions appear as a single string with `|` alternation. For envelope rows the array is locked to `[\"^[A-Z0-9]{8,13}$\"]` by the `aamva-envelope` conditional gate.",
            "items": {
              "type": "string",
              "pattern": "^\\^.+\\$$"
            }
          },
          "length_range": {
            "type": "object",
            "additionalProperties": false,
            "required": ["min", "max"],
            "properties": {
              "min": {"type": "integer", "minimum": 1},
              "max": {"type": "integer", "minimum": 1}
            },
            "description": "Character-count band post display-punctuation strip (Resecta normalizes hyphens / spaces before matching)."
          },
          "alphabet": {
            "type": "string",
            "minLength": 1,
            "description": "Human description of the character class (e.g. `numeric`, `alpha-prefixed`, `A-Z0-9`)."
          },
          "sample": {
            "type": "string",
            "minLength": 1,
            "description": "Synthetic example matching the row's pattern; not real PII."
          },
          "source_url": {
            "type": "string",
            "minLength": 1,
            "description": "Canonical publisher URL for the per-state primary source, OR — for envelope rows — an internal citation recording the source rationale (no Skyhigh / MyShn / NTSI aggregator citations on the four aggregator-retired envelope rows)."
          },
          "source_verified_date": {
            "type": "string",
            "pattern": "^\\d{4}-\\d{2}-\\d{2}$",
            "description": "ISO date the source was last verified. Initially attested rows: 2026-04-22; promoted/tightened rows: 2026-04-23; envelope rows: adopted 2026-04-25; statute-anchored rows: re-verified 2026-04-26."
          },
          "license_posture": {
            "type": "string",
            "enum": [
              "state-work",
              "permissive-OSS-MIT",
              "state-statute-anchored",
              "aamva-envelope"
            ],
            "description": "Per-row legal posture (4-value closed enum). `needs-legal-review` has been retired; every row now resolves to one of the four listed postures."
          },
          "license_notes": {
            "type": "string",
            "minLength": 1,
            "description": "Prose license rationale, source citations, and any caveats. For envelope rows: the four aggregator-retired rows must state that their aggregator lineage was retired; the remaining envelope rows carry a substitute rationale instead. Must NOT cite Skyhigh / MyShn / NTSI."
          },
          "attestation": {
            "type": "string",
            "enum": [
              "primary-published-spec",
              "federal-section-105",
              "dmv-prose-publication",
              "dmv-issued-specimen",
              "oss-mit-baseline",
              "news-quoted-spokesperson",
              "workflow-observed",
              "aamva-envelope"
            ],
            "description": "Attestation strength (ranks 1–7) plus the `aamva-envelope` marker for the M1 substitution rows."
          },
          "state_format_claimed": {
            "type": "boolean",
            "description": "Whether the row claims a per-state format. False on envelope rows (state-format claim retracted); true on all other rows."
          },
          "historical_variants": {
            "type": "array",
            "minItems": 1,
            "uniqueItems": true,
            "description": "Format-transition events that sit inside the active valid-DL renewal window (typically ~5–10 years). Empty / absent for rows with no recent transition or for envelope rows (per-state pattern not claimed). Mirrors the passport_patterns `recent_format_changes` shape.",
            "items": {
              "type": "object",
              "additionalProperties": false,
              "required": [
                "transition_date",
                "legacy_pattern",
                "current_pattern",
                "coexistence_window_notes"
              ],
              "properties": {
                "transition_date": {
                  "type": "string",
                  "pattern": "^\\d{4}-\\d{2}-\\d{2}$"
                },
                "legacy_pattern": {
                  "type": "string",
                  "pattern": "^\\^.+\\$$"
                },
                "current_pattern": {
                  "type": "string",
                  "pattern": "^\\^.+\\$$"
                },
                "coexistence_window_notes": {
                  "type": "string",
                  "minLength": 1
                }
              }
            }
          },
          "confidence": {
            "type": "string",
            "enum": ["low", "low-medium", "medium", "medium-high", "high"]
          },
          "pii_severity": {
            "type": "string",
            "enum": ["elevated"],
            "description": "Elevated PII-severity flag for Soundex / Gallian-style name-or-DOB-encoded DL formats. Optional; informational-only (a HIPAA Safe Harbor consideration). Live: FL, IL, MD, MI, WI; legacy still in circulation: MN pre-2004, NH pre-2017, WA legacy-PIC."
          },
          "dln_overlap_note": {
            "type": "string",
            "minLength": 1,
            "description": "SSN/DLN ambiguity note. Permitted only on AR/HI/ID/LA/MS rows (5 jurisdictions with legacy 9-digit DL visually indistinguishable from SSN). Notes two-way ambiguity between SSN and DLN only."
          },
          "f_flags": {
            "type": "array",
            "uniqueItems": true,
            "items": {
              "type": "string",
              "minLength": 1
            },
            "description": "Lifecycle markers such as `F-25-closed`, `F-39-closed`, `F-26-closed`, `F-29`, `F-34`, or `F-35`."
          }
        },
        "allOf": [
          {
            "if": {
              "properties": {"license_posture": {"const": "aamva-envelope"}},
              "required": ["license_posture"]
            },
            "then": {
              "properties": {
                "patterns": {"const": ["^[A-Z0-9]{8,13}$"]},
                "state_format_claimed": {"const": false},
                "attestation": {"const": "aamva-envelope"}
              }
            }
          },
          {
            "if": {
              "properties": {"license_posture": {"const": "state-statute-anchored"}},
              "required": ["license_posture"]
            },
            "then": {
              "properties": {
                "state_format_claimed": {"const": true},
                "attestation": {"const": "primary-published-spec"}
              }
            }
          },
          {
            "if": {
              "properties": {"attestation": {"const": "aamva-envelope"}},
              "required": ["attestation"]
            },
            "then": {
              "properties": {
                "license_posture": {"const": "aamva-envelope"}
              }
            }
          },
          {
            "if": {
              "required": ["dln_overlap_note"]
            },
            "then": {
              "properties": {
                "state_code": {
                  "enum": ["AR", "HI", "ID", "LA", "MS"]
                }
              }
            }
          }
        ]
      }
    }
  }
}
