{
  "version": 1,
  "generated_by": "cc-derive-d13 session 1",
  "source_briefs": [
    "W-R-3 (2026-04-22)",
    "W-R-5 (2026-04-23)",
    "V1 shipping dispositions §2 + §8 (2026-04-25)"
  ],
  "seed": 20260416,
  "generated_date": "2026-04-26",
  "_advisory_note": "F-32 Tier 2 advisory: WA driver-license specimen audit — JSON-only fact-extraction; no specimen images are redistributed. WA legacy PIC filler is moot under the AAMVA M1 envelope substitution (WA ships as envelope; per-state PIC format not reproduced). License-posture distribution: 11 state-work + 26 permissive-OSS-MIT + 3 state-statute-anchored + 11 aamva-envelope = 51; zero needs-legal-review.",
  "rows": [
    {
      "state_code": "AK",
      "state_name": "Alaska",
      "patterns": ["^[A-Z0-9]{8,13}$"],
      "length_range": {"min": 8, "max": 13},
      "alphabet": "A-Z0-9",
      "sample": "06244114",
      "source_url": "internal license register (AAMVA M1 envelope)",
      "source_verified_date": "2026-04-25",
      "license_posture": "aamva-envelope",
      "license_notes": "AAMVA M1 envelope substitution per V1 shipping disposition; canonical envelope per the V1 canonical register; state-format claim retracted; no per-state format reproduced. W-R-3 had `^[0-9]{1,7}$` (visual-only attestation per W-R-5 §3.1); pattern is superseded by envelope.",
      "attestation": "aamva-envelope",
      "state_format_claimed": false,
      "confidence": "medium",
      "f_flags": ["F-25-closed"]
    },
    {
      "state_code": "AL",
      "state_name": "Alabama",
      "patterns": ["^[0-9]{1,8}$"],
      "length_range": {"min": 1, "max": 8},
      "alphabet": "numeric",
      "sample": "6996164",
      "source_url": "https://www.alea.gov/dps/driver-license/license-and-id-cards",
      "source_verified_date": "2026-04-22",
      "license_posture": "permissive-OSS-MIT",
      "license_notes": "MIT baseline (gas-buddy/usdl-regex; adambullmer/USDLRegex) attests; ALEA site shows specimen but no prose format. Older aggregators say `{1,7}`; MIT baseline widened to `{1,8}`.",
      "attestation": "oss-mit-baseline",
      "state_format_claimed": true,
      "confidence": "medium",
      "f_flags": []
    },
    {
      "state_code": "AR",
      "state_name": "Arkansas",
      "patterns": ["^[0-9]{8,9}$"],
      "length_range": {"min": 8, "max": 9},
      "alphabet": "numeric",
      "sample": "123456789",
      "source_url": "https://www.ark.org/itvr-demo/help.html",
      "source_verified_date": "2026-04-23",
      "license_posture": "state-work",
      "license_notes": "AR INA TVR help page (ark.org state portal) prose-defines DL as 9-digit integer; 8-digit legacy normalized to 9 via zero-padding (`012345678`). Promoted from W-R-3 needs-legal-review per W-R-5 §3.2; tightened from {4,9} to {8,9}. Disconfirms aggregator (Skyhigh/MyShn-lineage) claim that AR DLs always begin with 9.",
      "attestation": "dmv-prose-publication",
      "state_format_claimed": true,
      "confidence": "medium-high",
      "dln_overlap_note": "Legacy 9-digit DL is visually indistinguishable from SSN; two-way DLN/SSN ambiguity (was three-way in an earlier revision; D-36 V1-WITHDRAWN). Detector mitigation routes via D-12 / D-16 A21 anchors — no D-36 dependency.",
      "f_flags": ["F-35"]
    },
    {
      "state_code": "AZ",
      "state_name": "Arizona",
      "patterns": ["^[A-Z][0-9]{8}$|^[0-9]{9}$"],
      "length_range": {"min": 9, "max": 9},
      "alphabet": "alpha-prefixed OR numeric",
      "sample": "B13654424",
      "source_url": "https://azdot.gov/mvd/services/driver-services/driver-license-information",
      "source_verified_date": "2026-04-22",
      "license_posture": "permissive-OSS-MIT",
      "license_notes": "ADOT MVD blog `Evolution of Arizona's Driver License` shows specimens; MIT baseline attests. Legacy 9-numeric (SSN-era) still in circulation.",
      "attestation": "dmv-issued-specimen",
      "state_format_claimed": true,
      "confidence": "medium-high",
      "f_flags": []
    },
    {
      "state_code": "CA",
      "state_name": "California",
      "patterns": ["^[A-Z][0-9]{7}$"],
      "length_range": {"min": 8, "max": 8},
      "alphabet": "alpha-prefixed",
      "sample": "A1234567",
      "source_url": "https://www.dmv.ca.gov/portal/handbook/california-driver-handbook/the-california-driver-license/",
      "source_verified_date": "2026-04-22",
      "license_posture": "permissive-OSS-MIT",
      "license_notes": "DMV handbook shows specimen (1 alpha + 7 numeric); 4 independent MIT libs agree; stable for decades.",
      "attestation": "dmv-prose-publication",
      "state_format_claimed": true,
      "confidence": "high",
      "f_flags": []
    },
    {
      "state_code": "CO",
      "state_name": "Colorado",
      "patterns": ["^[0-9]{9}$|^[A-Z][0-9]{3,6}$|^[A-Z]{2}[0-9]{2,5}$"],
      "length_range": {"min": 4, "max": 9},
      "alphabet": "numeric OR alpha-prefixed",
      "sample": "943320101",
      "source_url": "https://dmv.colorado.gov/",
      "source_verified_date": "2026-04-22",
      "license_posture": "permissive-OSS-MIT",
      "license_notes": "CO DMV silent; MIT baseline provides 3 alternations; primary form is 9-numeric. Legacy alpha-prefixed variants still circulate.",
      "attestation": "oss-mit-baseline",
      "state_format_claimed": true,
      "confidence": "medium",
      "f_flags": []
    },
    {
      "state_code": "CT",
      "state_name": "Connecticut",
      "patterns": ["^[0-9]{9}$"],
      "length_range": {"min": 9, "max": 9},
      "alphabet": "numeric",
      "sample": "146825129",
      "source_url": "https://portal.ct.gov/DMV",
      "source_verified_date": "2026-04-22",
      "license_posture": "permissive-OSS-MIT",
      "license_notes": "CT DMV silent on format; industry-wide convergent agreement on 9 numeric. Some legacy CT DLs historically encoded DOB in first 2 digits; shape unchanged.",
      "attestation": "oss-mit-baseline",
      "state_format_claimed": true,
      "confidence": "medium",
      "f_flags": []
    },
    {
      "state_code": "DC",
      "state_name": "District of Columbia",
      "patterns": ["^[A-Z0-9]{8,13}$"],
      "length_range": {"min": 8, "max": 13},
      "alphabet": "A-Z0-9",
      "sample": "04829105",
      "source_url": "internal license register (AAMVA M1 envelope)",
      "source_verified_date": "2026-04-25",
      "license_posture": "aamva-envelope",
      "license_notes": "AAMVA M1 envelope substitution per V1 shipping disposition; canonical envelope per the V1 canonical register; state-format claim retracted; no per-state format reproduced. W-R-3 had `^[0-9]{7}$` with secondary `^[0-9]{9}$` cohort per W-R-5 §3.12; live-vs-legacy unresolvable from primary sources, now moot under envelope.",
      "attestation": "aamva-envelope",
      "state_format_claimed": false,
      "confidence": "medium",
      "f_flags": ["F-25-closed"]
    },
    {
      "state_code": "DE",
      "state_name": "Delaware",
      "patterns": ["^[0-9]{1,7}$"],
      "length_range": {"min": 1, "max": 7},
      "alphabet": "numeric",
      "sample": "1232805",
      "source_url": "https://dmv.de.gov/DriverServices/drivers_license/index.shtml",
      "source_verified_date": "2026-04-22",
      "license_posture": "permissive-OSS-MIT",
      "license_notes": "DE DMV site carries State-of-Delaware footer copyright; factual format not restricted (Feist). MIT baseline attests.",
      "attestation": "oss-mit-baseline",
      "state_format_claimed": true,
      "confidence": "medium",
      "f_flags": []
    },
    {
      "state_code": "FL",
      "state_name": "Florida",
      "patterns": ["^[A-Z][0-9]{12}$"],
      "length_range": {"min": 13, "max": 13},
      "alphabet": "alpha-prefixed (Soundex-derived; current partially random)",
      "sample": "G544061739250",
      "source_url": "https://www.flhsmv.gov/2024/07/19/flhsmv-implements-legislation-requiring-driver-licenses-and-identification-card-numbers-to-change/",
      "source_verified_date": "2026-04-22",
      "license_posture": "state-work",
      "license_notes": "Fla. Stat. § 322.14(1)(a) prescribes format; FLHSMV release confirms shape unchanged and ≥4 digits now randomized post-2024-07-31. F-34: V1 regex shape unchanged; no checksum validation in V1 scope. Legacy algorithmic (Soundex of last name + DOB + gender) still in circulation.",
      "attestation": "dmv-prose-publication",
      "state_format_claimed": true,
      "confidence": "high",
      "pii_severity": "elevated",
      "f_flags": ["F-29", "F-34"]
    },
    {
      "state_code": "GA",
      "state_name": "Georgia",
      "patterns": ["^[0-9]{7,9}$"],
      "length_range": {"min": 7, "max": 9},
      "alphabet": "numeric",
      "sample": "099999999",
      "source_url": "https://dds.georgia.gov/georgia-licenseid",
      "source_verified_date": "2026-04-22",
      "license_posture": "permissive-OSS-MIT",
      "license_notes": "DDS (Driver Services) shows specimen but does not prose-document format. MIT baseline attests. 7-digit legacy numbers still exist.",
      "attestation": "dmv-issued-specimen",
      "state_format_claimed": true,
      "confidence": "medium-high",
      "f_flags": []
    },
    {
      "state_code": "HI",
      "state_name": "Hawaii",
      "patterns": ["^[A-Z][0-9]{8}$|^[0-9]{9}$"],
      "length_range": {"min": 9, "max": 9},
      "alphabet": "alpha-prefixed OR numeric",
      "sample": "H00000002",
      "source_url": "https://hidot.hawaii.gov/highways/motor-vehicle-safety-office/drivers-licensing-cdl/",
      "source_verified_date": "2026-04-22",
      "license_posture": "permissive-OSS-MIT",
      "license_notes": "HI DLs are issued at the county level; no centralized format page. MIT baseline attests. Legacy 9-numeric (SSN-era) still in circulation.",
      "attestation": "oss-mit-baseline",
      "state_format_claimed": true,
      "confidence": "medium",